{
  "metadata": {
    "id": "loss-correct",
    "title": "Loss Calculation (Correct)",
    "width": 300,
    "height": 270
  },
  "components": [
    {
      "id": "target",
      "type": "input",
      "template": "input_box",
      "position": {"x": 20, "y": 20},
      "width": 100,
      "height": 60,
      "custom_text": {
        "label": "Target",
        "subtext": "'C' [0,0,1,0]"
      }
    },
    {
      "id": "prediction",
      "type": "simple",
      "template": "simple_box",
      "position": {"x": 180, "y": 20},
      "width": 100,
      "height": 60,
      "custom_text": {
        "label": "Prediction",
        "subtext": "[0.1,0.2,0.6,0.1]"
      }
    },
    {
      "id": "compare",
      "type": "simple",
      "template": "simple_box",
      "position": {"x": 100, "y": 110},
      "width": 100,
      "height": 50,
      "custom_text": {
        "label": "Compare",
        "subtext": ""
      }
    },
    {
      "id": "loss",
      "type": "simple",
      "template": "simple_box",
      "position": {"x": 100, "y": 190},
      "width": 100,
      "height": 60,
      "custom_text": {
        "label": "Loss",
        "subtext": "L = -log(0.6) = 0.51"
      }
    }
  ],
  "connections": [
    {
      "from": "target.output",
      "to": "compare.input",
      "style": "forward"
    },
    {
      "from": "prediction.output",
      "to": "compare.input",
      "style": "forward"
    },
    {
      "from": "compare.output",
      "to": "loss.input",
      "style": "forward"
    }
  ],
  "labels": []
}

