{
  "metadata": {
    "id": "cross-entropy-loss",
    "title": "Cross-Entropy Loss: L = -log(P(target))",
    "width": 600,
    "height": 400
  },
  "components": [
    {
      "id": "axis_system",
      "type": "axis",
      "template": "axis_system",
      "position": {"x": 80, "y": 60},
      "width": 400,
      "height": 300,
      "custom_text": {
        "x_label": "Predicted Probability P(target)",
        "y_label": "Loss L",
        "x_range": [0, 1],
        "y_range": [0, 5]
      }
    },
    {
      "id": "loss_curve",
      "type": "plot",
      "template": "plot_line",
      "position": {"x": 80, "y": 60},
      "width": 400,
      "height": 300,
      "custom_text": {
        "function": "L = -log(p)",
        "color": "#dc2626"
      }
    }
  ],
  "connections": [],
  "labels": [
    {
      "type": "title",
      "text": "Cross-Entropy Loss: L = -log(P(target))",
      "priority": 1
    },
    {
      "type": "note",
      "text": "Lower probability â†’ Higher loss",
      "priority": 5
    }
  ]
}

