{
  "metadata": {
    "id": "probability-pmf-biased-coin",
    "title": "Biased Coin PMF: P(Heads) = 0.7",
    "width": 500,
    "height": 400,
    "diagram_type": "graph"
  },
  "components": [
    {
      "id": "axis_system",
      "type": "axis",
      "template": "axis_system",
      "position": {"x": 100, "y": 50},
      "width": 300,
      "height": 300,
      "custom_text": {
        "x_label": "Outcome",
        "y_label": "Probability",
        "x_range": [0, 2],
        "y_range": [0, 1]
      }
    },
    {
      "id": "bar_chart",
      "type": "plot",
      "template": "bar_chart",
      "position": {"x": 100, "y": 50},
      "width": 300,
      "height": 300,
      "custom_text": {
        "data": [
          {"label": "Heads", "value": 0.7, "color": "#16a34a"},
          {"label": "Tails", "value": 0.3, "color": "#dc2626"}
        ]
      }
    }
  ],
  "connections": [],
  "labels": [
    {
      "type": "title",
      "text": "Biased Coin PMF: P(Heads) = 0.7",
      "priority": 1
    },
    {
      "type": "note",
      "text": "P(Heads) = 0.7, P(Tails) = 0.3 | Sum = 1.0 âœ“",
      "priority": 5
    }
  ]
}
