{
  "metadata": {
    "id": "activation-graph-sigmoid",
    "title": "Sigmoid",
    "width": 280,
    "height": 280
  },
  "components": [
    {
      "id": "axis_system",
      "type": "axis",
      "template": "axis_system",
      "position": {"x": 40, "y": 70},
      "width": 200,
      "height": 200,
      "custom_text": {
        "x_label": "x",
        "y_label": "f(x)",
        "x_range": [-3, 3],
        "y_range": [0, 1]
      }
    },
    {
      "id": "plot_line",
      "type": "plot",
      "template": "plot_line",
      "position": {"x": 40, "y": 70},
      "width": 200,
      "height": 200,
      "custom_text": {
        "function": "f(x) = 1/(1+e⁻ˣ)",
        "color": "#dc2626"
      }
    }
  ],
  "connections": [],
  "labels": [
    {
      "type": "title",
      "text": "Sigmoid",
      "priority": 1
    },
    {
      "type": "equation",
      "text": "f(x) = 1/(1+e⁻ˣ)",
      "priority": 2
    }
  ]
}

