{
  "metadata": {
    "id": "hyperplane-1d",
    "title": "1D Input (d=1)",
    "width": 400,
    "height": 300
  },
  "components": [
    {
      "id": "axis_system",
      "type": "axis",
      "template": "axis_system",
      "position": {"x": 50, "y": 80},
      "width": 300,
      "height": 80,
      "custom_text": {
        "x_label": "x",
        "y_label": "",
        "x_range": [-1, 1],
        "y_range": [0, 1]
      }
    },
    {
      "id": "decision_point",
      "type": "simple",
      "template": "simple_box",
      "position": {"x": 175, "y": 100},
      "width": 0,
      "height": 0,
      "custom_text": {
        "label": "Decision Point",
        "subtext": ""
      }
    },
    {
      "id": "positive_region",
      "type": "plot",
      "template": "plot_region",
      "position": {"x": 175, "y": 50},
      "width": 125,
      "height": 50,
      "custom_text": {
        "label": "w·x + b > 0",
        "color": "#16a34a"
      }
    },
    {
      "id": "negative_region",
      "type": "plot",
      "template": "plot_region",
      "position": {"x": 50, "y": 50},
      "width": 125,
      "height": 50,
      "custom_text": {
        "label": "w·x + b < 0",
        "color": "#dc2626"
      }
    }
  ],
  "connections": [],
  "labels": [
    {
      "type": "title",
      "text": "1D Input (d=1)",
      "priority": 1
    },
    {
      "type": "equation",
      "text": "w₁x₁ + b = 0",
      "priority": 2
    }
  ]
}
